{
  "$schema": "../../schema/scenario-solution.schema.json",
  "summary": "Each request hides a definition, a purpose and an audience. Ask about those three before building. Everything else (visual type, colours, tool) can be proposed later.",
  "steps": [
    "Profitability by customer: costs included, grain, which source it reconciles to, refresh frequency.",
    "Add margin: definition (and whether it must match Finance), who may see it, what decision it supports.",
    "Near-real-time: which decision happens within minutes and by whom, acceptable latency in minutes, which metrics need it.",
    "Match the board pack: which numbers and to what tolerance, which version and when it locks, who signs off.",
    "Route technical questions (source load, cost data quality) to Kenji or Finance, not to the requester."
  ],
  "artifacts": [{ "title": "Three questions to ask on every request", "lang": "md", "body": [
    "1. **What does each key word mean as a number?** (Revenue, margin, real time, match.) Get it written down.",
    "2. **What decision will this support, and who makes it?** This decides grain, latency and design.",
    "3. **Who may see it, and who confirms it's right?** Security and acceptance need named owners."
  ] }],
  "review": {
    "junior": "Asks about colours and chart types, then builds with their own definitions.",
    "competent": "Asks for definitions and refresh frequency.",
    "senior": "Asks about definitions, decisions, audience and acceptance, and sends technical questions to the right people.",
    "architect": "Turns the answers into entries in the KPI dictionary and a request template the whole team uses."
  }
}
