{
  "$schema": "../../schema/scenario-solution.schema.json",
  "summary": "Request changes. The margin itself is useful, but the PR adds a calculated column and a text column to a 31-million-row fact, two measures for the same thing (one named m1 with the / operator), a hard-coded year, an unrestricted MAXX, and a bi-directional relationship that Sprint 04 just removed for performance. Two changes block the merge; the rest are quick fixes in the same PR.",
  "steps": [
    "Line Margin (calculated column on FactSales): computed and stored for 31M rows, increases model size and refresh. Use a measure with SUMX, or compute margin upstream in the warehouse view. Blocking.",
    "Order Year Text: duplicates DimDate[Year] as text on the fact, so filters bypass the date table and string comparisons are fragile. Delete it; use DimDate.",
    "m1: meaningless name, no display folder or description, / instead of DIVIDE (divide-by-zero errors). It duplicates 'Margin %'. Delete m1.",
    "'Sales 2026': hard-coded year that silently becomes wrong in January. Use the date table and time intelligence (e.g. DATESYTD) or let the slicer decide.",
    "'Top Customer Sales': MAXX over DimCustomer iterates every customer (410k) with a context transition per row. Fine if needed, but name it for what it does and check the performance budget.",
    "New relationship with crossFilteringBehavior: bothDirections on FactSales → DimCustomer: Sprint 04 removed exactly this for performance and ambiguity. Blocking without an ADR.",
    "All new measures lack descriptions, which the team standard requires; add them (they also feed the KPI dictionary)."
  ],
  "artifacts": [{ "title": "Review comment example", "lang": "md", "body": [
    "**FactSales.tmdl +45 `column 'Line Margin'`: request change.** A calculated column here is stored for all 31M rows (~+250 MB) and recalculated on every refresh. Margin only needs to be aggregated, so a measure does the same job at query time: `Margin = SUMX ( FactSales, FactSales[Qty] * ( FactSales[UnitPriceUSD] - RELATED ( DimProduct[UnitCostUSD] ) ) )`. Or, better long-term, add UnitCostUSD to the warehouse view so margin is a simple SUM. Happy to pair on it before 3pm.",
    "",
    "**Decision:** request changes. Blocking: Line Margin column, bi-directional relationship. Same PR, quick: delete m1 and Order Year Text, replace the hard-coded year, add descriptions. I'll re-review as soon as you push."
  ] }],
  "review": {
    "junior": "Approves because Sam tested it and it's urgent.",
    "competent": "Spots the calculated column and the duplicate measure.",
    "senior": "Finds all issues, explains each with impact, separates blocking from non-blocking, offers help to hit the deadline.",
    "architect": "Turns the recurring findings into BPA rules and a PR template so reviewers spend time on design, not on naming."
  }
}
